{
  "version": "1",
  "chainId": "31337",
  "verifyingContract": "0x1111111111111111111111111111111111111111",
  "bountyId": "7",
  "attemptId": "1",
  "organizationId": "0x2222222222222222222222222222222222222222222222222222222222222222",
  "signerEpoch": "1",
  "attemptDigest": "0x3333333333333333333333333333333333333333333333333333333333333333",
  "manifestDigest": "0x4444444444444444444444444444444444444444444444444444444444444444",
  "verifierPolicyDigest": "0x5555555555555555555555555555555555555555555555555555555555555555",
  "headGitSha": "0x6666666666666666666666666666666666666666",
  "reportDigest": "0x7777777777777777777777777777777777777777777777777777777777777777",
  "imageDigest": "0x8888888888888888888888888888888888888888888888888888888888888888",
  "outcome": 1,
  "baselineFailed": true,
  "candidatePassed": true,
  "regressionsPassed": true,
  "expiresAt": "1790000000",
  "signatureScheme": "eip712-secp256k1",
  "signature": "0x9999999999999999999999999999999999999999999999999999999999999999999999999999999999999999999999999999999999999999999999999999999999"
}
